{
  "id": "underground_tunnel_south",
  "name": "Underground Tunnel South",
  "map": {
    "width": 20,
    "height": 18,
    "tileset": "underground",
    "music": "MUSIC_UNDERGROUND",
    "map_id": "MAP_UNDERGROUND_TUNNEL_SOUTH"
  },
  "default_walkable": "underground.underground_floor_with_debris_1",
  "layers": {
    "terrain": [
      {
        "x": 0,
        "y": 0,
        "width": 1,
        "height": 1,
        "tile": "underground.underground_top_left_corner_wall"
      },
      {
        "x": 1,
        "y": 0,
        "width": 18,
        "height": 1,
        "tile": "underground.underground_top_wall_1"
      },
      {
        "x": 19,
        "y": 0,
        "width": 1,
        "height": 1,
        "tile": "underground.underground_top_right_corner_wall"
      },
      {
        "x": 0,
        "y": 1,
        "width": 1,
        "height": 16,
        "tile": "underground.underground_left_wall_1"
      },
      {
        "x": 19,
        "y": 1,
        "width": 1,
        "height": 16,
        "tile": "underground.underground_right_wall_1"
      },
      {
        "x": 0,
        "y": 17,
        "width": 1,
        "height": 1,
        "tile": "underground.underground_bottom_left_corner_wall"
      },
      {
        "x": 1,
        "y": 17,
        "width": 18,
        "height": 1,
        "tile": "underground.underground_bottom_wall_1"
      },
      {
        "x": 19,
        "y": 17,
        "width": 1,
        "height": 1,
        "tile": "underground.underground_bottom_right_corner_wall"
      },
      {
        "x": 1,
        "y": 1,
        "width": 16,
        "height": 4,
        "tile": "underground.underground_top_wall_2"
      },
      {
        "x": 18,
        "y": 1,
        "width": 1,
        "height": 4,
        "tile": "underground.underground_right_wall_2"
      },
      {
        "x": 17,
        "y": 1,
        "width": 1,
        "height": 1,
        "tile": "underground.underground_top_wall_3"
      },
      {
        "x": 1,
        "y": 5,
        "width": 11,
        "height": 5,
        "tile": "underground.underground_top_wall_3"
      },
      {
        "x": 1,
        "y": 10,
        "width": 5,
        "height": 1,
        "tile": "underground.underground_left_wall_1"
      },
      {
        "x": 1,
        "y": 11,
        "width": 1,
        "height": 5,
        "tile": "underground.underground_left_wall_2"
      },
      {
        "x": 3,
        "y": 11,
        "width": 3,
        "height": 4,
        "tile": "underground.underground_bottom_wall_2"
      },
      {
        "x": 7,
        "y": 11,
        "width": 12,
        "height": 5,
        "tile": "underground.underground_bottom_wall_3"
      },
      {
        "x": 13,
        "y": 6,
        "width": 6,
        "height": 4,
        "tile": "underground.underground_right_wall_3"
      },
      {
        "x": 13,
        "y": 10,
        "width": 6,
        "height": 1,
        "tile": "underground.underground_right_wall_4"
      },
      {
        "x": 18,
        "y": 5,
        "width": 1,
        "height": 1,
        "tile": "underground.underground_right_wall_1"
      },
      {
        "x": 1,
        "y": 16,
        "width": 18,
        "height": 1,
        "tile": "underground.underground_bottom_wall_4"
      },
      {
        "x": 2,
        "y": 15,
        "width": 1,
        "height": 1,
        "tile": "underground.underground_stairs"
      },
      {
        "x": 17,
        "y": 2,
        "width": 1,
        "height": 1,
        "tile": "underground.underground_stairs"
      }
    ]
  },
  "player": {
    "spawn": {
      "x": 3,
      "y": 15,
      "facing": "EAST",
      "animation_frames": [
        "actors.actors_hero_frame_1",
        "actors.actors_hero_frame_2"
      ]
    }
  },
  "exits": [
    {
      "x": 2,
      "y": 15,
      "target_scene": "desolate_field",
      "target_x": 22,
      "target_y": 11,
      "direction": "SOUTH",
      "tile_char": ">",
      "tunnel": "tunnel_desolate_underground"
    },
    {
      "x": 17,
      "y": 2,
      "target_scene": "south_ridge",
      "target_x": 6,
      "target_y": 16,
      "direction": "NORTH",
      "tile_char": "<",
      "tunnel": "tunnel_south_underground"
    }
  ],
  "neighbors": {
    "north": "",
    "south": "",
    "east": "",
    "west": ""
  },
  "objects": [],
  "regions": [
    {
      "id": "dark_tunnel_south",
      "bounds": {
        "x": 2,
        "y": 2,
        "width": 16,
        "height": 14
      },
      "description": "A second unlit stone tunnel linking the Desolate Field stairs to the South Ridge stairs.",
      "gameplay": {
        "purpose": "passage",
        "difficulty": 1
      }
    }
  ]
}
